{
  "complex_ids": [
    "1a4w",
    "1hsg",
    "3ptb"
  ],
  "created_or_updated": "2026-06-04",
  "dataset_id": "rgroup_smoke",
  "dataset_view_id": "rgroup_smoke_view_v1",
  "entry_index_path": "data/datasets/rgroup_smoke/entries/index.jsonl",
  "entry_manifest_path": "data/datasets/rgroup_smoke/manifests/entries/rgroup_smoke_entries_manifest_v1.json",
  "notes": "Dataset view manifest separates smoke/smoke-plus views from raw file roots.",
  "raw_manifest_path": "data/datasets/rgroup_smoke/manifests/raw/rcsb_smoke_complexes_raw_manifest_v1.json",
  "schema_path": "schemas/data/datasets/views/dataset_view_v0_1.json",
  "schema_version": "dataset_view_v0_1",
  "split_counts": {
    "test": 0,
    "train": 3,
    "validation": 0
  },
  "split_manifest_path": "data/datasets/rgroup_smoke/splits/rgroup_smoke_split_v1.json"
}
